{
  "allowed_scope": [
    "financial-engine_v2/backend/app/services/extraction_eval.py",
    "financial-engine_v2/backend/app/services/extraction_gold_eval.py",
    "financial-engine_v2/backend/tests/test_extraction_eval.py",
    "financial-engine_v2/backend/tests/test_extraction_eval_harness.py",
    "financial-engine_v2/backend/tests/test_extraction_gold_eval.py"
  ],
  "ended_at": "2026-07-25T04:35:50.640323+00:00",
  "outcome": "FAILED",
  "output": {
    "hash": "e3b0c44298fc1c149afbf4c8996fb92427ae41e4649b934ca495991b7852b855",
    "kind": "none",
    "reference": ""
  },
  "prompt_hash": "1bbb5077adb1fbd0c57230d931197897e68204e534c05a09d9513bf3620ee9fc",
  "result_hash": "62b30c5514db04c1ee4a985976a83a955aaf94ee9fd09ad775002847b19bfe86",
  "role": "IMPLEMENTER",
  "run_id": "20260725T041849Z-107c926930-e0e992",
  "session_id": "019f978e-6163-77f3-b30c-4b124d4a029f",
  "started_at": "2026-07-25T04:35:18.161728+00:00",
  "ticket_id": "ASXFP_01_SCORECARDS"
}
